{
  "contractVersion": "1.0.0",
  "sourceId": "11111111-1111-4111-8111-111111111111",
  "registrationGeneration": "registration-generation-v1",
  "displayName": "Operational Records",
  "kind": "relational",
  "connectorId": "connectors/tabular-reader-v1",
  "connectorVersion": "1.0.0",
  "connectorCapabilityHash": "ccca6841c2a5d15058240039228b22351d60e6279bdcef5f1b78f687b7114ade",
  "locator": {
    "registeredEndpointId": "endpoints-example-reader",
    "resource": "operations",
    "subresource": null
  },
  "authorizationScope": {
    "scopeId": "authorized-assets",
    "principalMode": "service",
    "authorizedOperations": [
      "enumerate",
      "read-structure",
      "read-content",
      "sample",
      "aggregate",
      "read-constraints",
      "read-lineage",
      "read-usage-history",
      "safe-probe"
    ]
  },
  "credentialRef": {
    "providerId": "secure-reference-store",
    "referenceId": "abababab-abab-4bab-8bab-abababababab"
  },
  "requestedCapabilities": [
    "enumerate-assets",
    "read-structure",
    "estimate-size",
    "deterministic-sample",
    "aggregate-statistics",
    "read-constraints",
    "read-lineage",
    "read-usage-history",
    "execute-safe-probe"
  ],
  "connectorDeclaredCapabilities": [
    "enumerate-assets",
    "read-structure",
    "estimate-size",
    "deterministic-sample",
    "aggregate-statistics",
    "read-constraints",
    "read-lineage",
    "read-usage-history",
    "execute-safe-probe"
  ],
  "policyAuthorizedCapabilities": [
    "enumerate-assets",
    "read-structure",
    "estimate-size",
    "deterministic-sample",
    "aggregate-statistics",
    "read-constraints",
    "read-lineage",
    "read-usage-history",
    "execute-safe-probe"
  ],
  "effectiveCapabilities": [
    "enumerate-assets",
    "read-structure",
    "estimate-size",
    "deterministic-sample",
    "aggregate-statistics",
    "read-constraints",
    "read-lineage",
    "read-usage-history",
    "execute-safe-probe"
  ],
  "policyRef": "policies/default-readonly-v1",
  "registrationValidation": {
    "secretScanPassed": true,
    "locatorValidated": true,
    "credentialReferenceResolved": true,
    "endpointRegistryVersion": "1.0.0",
    "credentialRegistryVersion": "1.0.0",
    "checkedAt": "2026-01-01T00:00:00Z"
  },
  "tags": {
    "environment": "example",
    "classification": "restricted"
  }
}
